{
  "$schema": "https://json-schema.org/draft/2020-12/schema",
  "title": "ResultatExecution",
  "description": "Un passage du candidat sur une tâche, pour une répétition. « ? » signifie inconnu, et le rapport le montre ; null signifie sans objet. Une erreur technique (API en panne, coupure) n'est pas un échec de l'agent : l'exécution est relancée et le rapport compte ces erreurs. EASE vérifie au chargement le score recalculé, la réussite et la cohérence avec la tâche.",
  "type": "object",
  "additionalProperties": false,
  "required": [
    "run",
    "tache",
    "repetition",
    "debut_utc",
    "fin_utc",
    "arret",
    "detail_arret",
    "controles",
    "score",
    "reussie",
    "etapes",
    "jetons",
    "cout_dollars",
    "energie_wh",
    "duree_secondes",
    "journal"
  ],
  "properties": {
    "run": {
      "$ref": "#/$defs/IdentifiantRun"
    },
    "tache": {
      "$ref": "#/$defs/ReferenceTache"
    },
    "repetition": {
      "type": "integer",
      "minimum": 1
    },
    "debut_utc": {
      "$ref": "#/$defs/HorodatageUTC"
    },
    "fin_utc": {
      "$ref": "#/$defs/HorodatageUTC"
    },
    "arret": {
      "type": "string",
      "enum": [
        "termine",
        "budget_etapes",
        "budget_cout",
        "erreur_technique",
        "contexte_depasse",
        "delai_depasse"
      ],
      "description": "Fin normale, budget dépassé, erreur technique sans rapport avec l'agent, contexte du modèle dépassé ou délai dépassé : ces deux derniers sont des échecs de l'agent, comptés dans le taux chacun sous son arrêt (cadrage du 2026-10-14, choix T3 ; cadrage du générateur des images, choix D1)."
    },
    "detail_arret": {
      "anyOf": [
        {
          "type": "string",
          "minLength": 1
        },
        {
          "type": "null"
        }
      ]
    },
    "controles": {
      "type": "array",
      "minItems": 1,
      "items": {
        "$ref": "#/$defs/ResultatControle"
      }
    },
    "score": {
      "type": "number",
      "minimum": 0,
      "maximum": 1,
      "description": "Somme des scores pondérés par les poids."
    },
    "reussie": {
      "type": "boolean",
      "description": "Vrai si l'exécution s'est terminée normalement et que chaque contrôle a son score plein."
    },
    "etapes": {
      "type": "integer",
      "minimum": 0,
      "description": "Nombre d'appels d'outils."
    },
    "jetons": {
      "$ref": "#/$defs/Jetons"
    },
    "cout_dollars": {
      "anyOf": [
        {
          "type": "number",
          "minimum": 0
        },
        {
          "$ref": "#/$defs/Inconnu"
        }
      ]
    },
    "energie_wh": {
      "description": "Énergie électrique de la carte graphique qui sert un modèle local pendant l'exécution, en wattheures, relevée par nvidia-smi. La machine entière consomme davantage : c'est un minimum. « ? » si le relevé a manqué ; null pour un candidat sans modèle local.",
      "anyOf": [
        {
          "type": "number",
          "minimum": 0
        },
        {
          "$ref": "#/$defs/Inconnu"
        },
        {
          "type": "null"
        }
      ]
    },
    "duree_secondes": {
      "type": "number",
      "minimum": 0
    },
    "duree_chronometree_secondes": {
      "description": "Poste humain seulement : durée chronométrée par le poste, de « Commencer » à « J'ai fini », en secondes, reprise de sa sortie ; duree_secondes compte en plus l'attente avant « Commencer ». null pour un agent ; absente des résultats écrits avant le 2026-10-13.",
      "anyOf": [
        {
          "type": "number",
          "minimum": 0
        },
        {
          "type": "null"
        }
      ]
    },
    "journal": {
      "type": "string",
      "pattern": "^[A-Za-z0-9_][A-Za-z0-9_./-]*$",
      "description": "Chemin du journal des actions, relatif au dossier du run."
    }
  },
  "$defs": {
    "Inconnu": {
      "const": "?",
      "description": "Valeur inconnue ; le rapport la montre comme telle."
    },
    "HorodatageUTC": {
      "type": "string",
      "format": "date-time",
      "description": "Date et heure en UTC, au format RFC 3339 (par exemple 2026-11-03T14:00:00Z)."
    },
    "IdentifiantRun": {
      "type": "string",
      "pattern": "^[0-9]{4}-[0-9]{2}-[0-9]{2}_[a-z0-9_]+$",
      "description": "Date de début du run en UTC, puis un nom ; c'est aussi le nom du dossier du run."
    },
    "ReferenceTache": {
      "title": "ReferenceTache",
      "description": "Tâche exécutée, avec sa version.",
      "type": "object",
      "additionalProperties": false,
      "required": [
        "identifiant",
        "version"
      ],
      "properties": {
        "identifiant": {
          "type": "string",
          "pattern": "^[a-z0-9_]+$"
        },
        "version": {
          "type": "integer",
          "minimum": 1
        }
      }
    },
    "ResultatControle": {
      "title": "ResultatControle",
      "description": "Score d'un contrôle de la tâche ; famille et poids sont recopiés de la tâche.",
      "type": "object",
      "additionalProperties": false,
      "required": [
        "numero",
        "famille",
        "poids",
        "score",
        "detail"
      ],
      "properties": {
        "numero": {
          "type": "integer",
          "minimum": 1,
          "description": "Rang du contrôle dans la tâche, à partir de 1."
        },
        "famille": {
          "type": "string",
          "enum": [
            "resultat",
            "absence_effet_de_bord",
            "respect_des_regles",
            "budget",
            "contenu",
            "provenance"
          ]
        },
        "poids": {
          "type": "number",
          "exclusiveMinimum": 0,
          "maximum": 1
        },
        "score": {
          "type": "number",
          "minimum": 0,
          "maximum": 1,
          "description": "De 0 à 1 ; une valeur intermédiaire est un crédit partiel."
        },
        "detail": {
          "anyOf": [
            {
              "type": "string",
              "minLength": 1
            },
            {
              "type": "null"
            }
          ]
        }
      }
    },
    "Jetons": {
      "title": "Jetons",
      "description": "Jetons consommés. L'entrée compte aussi la part servie depuis le cache.",
      "type": "object",
      "additionalProperties": false,
      "required": [
        "entree",
        "entree_en_cache",
        "sortie"
      ],
      "properties": {
        "entree": {
          "anyOf": [
            {
              "type": "integer",
              "minimum": 0
            },
            {
              "$ref": "#/$defs/Inconnu"
            }
          ]
        },
        "entree_en_cache": {
          "anyOf": [
            {
              "type": "integer",
              "minimum": 0
            },
            {
              "$ref": "#/$defs/Inconnu"
            }
          ]
        },
        "sortie": {
          "anyOf": [
            {
              "type": "integer",
              "minimum": 0
            },
            {
              "$ref": "#/$defs/Inconnu"
            }
          ]
        }
      }
    }
  }
}
