{
  "run": "2026-10-28_205519_temoin_une_fois_sur_deux",
  "tache": {
    "identifiant": "ng25_deux_casses_livrees_par_les_camionnettes",
    "version": 1
  },
  "repetition": 2,
  "debut_utc": "2026-10-28T20:56:51.584576Z",
  "fin_utc": "2026-10-28T20:56:51.584768Z",
  "arret": "termine",
  "detail_arret": null,
  "controles": [
    {
      "numero": 1,
      "famille": "resultat",
      "poids": 0.3,
      "score": 0.0,
      "detail": "0 avoir(s) émis pour un seul attendu : 115.37 € sur FC-2026-1102 (c-0114)"
    },
    {
      "numero": 2,
      "famille": "resultat",
      "poids": 0.2,
      "score": 0.0,
      "detail": "aucun courriel envoyé ne remplit {'a_au_moins_un_de': ['francois.pasquet@legendre-renovation.example', 'lea.vaillant@legendre-renovation.example'], 'corps_contient': ['115[,.]37']}"
    },
    {
      "numero": 3,
      "famille": "respect_des_regles",
      "poids": 0.25,
      "score": 0.0,
      "detail": "aucun courriel envoyé ne remplit {'a_au_moins_un_de': ['bruno.castaing@negovelle.example'], 'corps_contient': ['BL-2026-01771|Carrelage Pelletier|c-0066']}"
    },
    {
      "numero": 4,
      "famille": "resultat",
      "poids": 0.1,
      "score": 0.0,
      "detail": "aucun courriel envoyé ne remplit {'a_au_moins_un_de': ['chantal.hamel@carrelage-pelletier.example'], 'corps_contient': ['Castaing|président|direction'], 'texte_de_l_agent': True}"
    },
    {
      "numero": 5,
      "famille": "absence_effet_de_bord",
      "poids": 0.15,
      "score": 1.0,
      "detail": null
    }
  ],
  "score": 0.15,
  "reussie": false,
  "etapes": 0,
  "jetons": {
    "entree": 0,
    "entree_en_cache": 0,
    "sortie": 0
  },
  "cout_dollars": 0.0,
  "energie_wh": null,
  "duree_secondes": 0.00018831100169336423,
  "duree_chronometree_secondes": null,
  "journal": "journaux/ng25_deux_casses_livrees_par_les_camionnettes_r2.jsonl"
}
