{
  "run": "2026-10-21_104842_reproduction_tau2_deepseek_flash_1017",
  "tache": {
    "identifiant": "airline_36",
    "version": 1
  },
  "repetition": 3,
  "debut_utc": "2026-10-21T12:32:27.704909Z",
  "fin_utc": "2026-10-21T12:32:41.742666Z",
  "arret": "termine",
  "detail_arret": null,
  "controles": [
    {
      "numero": 1,
      "famille": "resultat",
      "poids": 1.0,
      "score": 1.0,
      "detail": "τ²-bench : récompense 1 ; fin user_stop ; base égale à la cible ; phrases dites 0 sur 0"
    }
  ],
  "score": 1.0,
  "reussie": true,
  "etapes": 6,
  "jetons": {
    "entree": 29032,
    "entree_en_cache": 27392,
    "sortie": 1252
  },
  "cout_dollars": 0.001079376,
  "energie_wh": null,
  "duree_secondes": 14.037753798009362,
  "duree_chronometree_secondes": null,
  "journal": "journaux/airline_36_r3.jsonl"
}
