{
  "run": "2026-10-28_201858_temoin_parfait",
  "tache": {
    "identifiant": "t52_deux_climatiseurs",
    "version": 1
  },
  "repetition": 4,
  "debut_utc": "2026-10-28T20:20:57.604738Z",
  "fin_utc": "2026-10-28T20:20:57.688364Z",
  "arret": "termine",
  "detail_arret": null,
  "controles": [
    {
      "numero": 1,
      "famille": "resultat",
      "poids": 0.35,
      "score": 1.0,
      "detail": null
    },
    {
      "numero": 2,
      "famille": "resultat",
      "poids": 0.35,
      "score": 1.0,
      "detail": null
    },
    {
      "numero": 3,
      "famille": "contenu",
      "poids": 0.15,
      "score": 1.0,
      "detail": null
    },
    {
      "numero": 4,
      "famille": "absence_effet_de_bord",
      "poids": 0.15,
      "score": 1.0,
      "detail": null
    }
  ],
  "score": 1.0,
  "reussie": true,
  "etapes": 16,
  "jetons": {
    "entree": 0,
    "entree_en_cache": 0,
    "sortie": 0
  },
  "cout_dollars": 0.0,
  "energie_wh": null,
  "duree_secondes": 0.08362311899691122,
  "duree_chronometree_secondes": null,
  "journal": "journaux/t52_deux_climatiseurs_r4.jsonl"
}
