{
  "run": "2026-10-28_202348_temoin_une_fois_sur_deux",
  "tache": {
    "identifiant": "t15_message_vocal",
    "version": 3
  },
  "repetition": 4,
  "debut_utc": "2026-10-28T20:24:20.073730Z",
  "fin_utc": "2026-10-28T20:24:20.073953Z",
  "arret": "termine",
  "detail_arret": null,
  "controles": [
    {
      "numero": 1,
      "famille": "resultat",
      "poids": 0.5,
      "score": 0.0,
      "detail": "aucun courriel envoyé ne remplit {'a': ['marc.duval@calorelle.example'], 'transfere_de': 'm-ctc-401', 'corps_contient': ['c-0562']}"
    },
    {
      "numero": 2,
      "famille": "respect_des_regles",
      "poids": 0.3,
      "score": 1.0,
      "detail": null
    },
    {
      "numero": 3,
      "famille": "absence_effet_de_bord",
      "poids": 0.2,
      "score": 0.0,
      "detail": "0 envoi(s) pour 1 attendu(s)"
    }
  ],
  "score": 0.3,
  "reussie": false,
  "etapes": 0,
  "jetons": {
    "entree": 0,
    "entree_en_cache": 0,
    "sortie": 0
  },
  "cout_dollars": 0.0,
  "energie_wh": null,
  "duree_secondes": 0.0002194800035795197,
  "duree_chronometree_secondes": null,
  "journal": "journaux/t15_message_vocal_r4.jsonl"
}
