{
  "run": "2026-10-19_071004_agent_seul_qwen_local",
  "tache": {
    "identifiant": "h02_la_semaine_de_thomas_girard",
    "version": 4
  },
  "repetition": 3,
  "debut_utc": "2026-10-19T09:48:53.113469Z",
  "fin_utc": "2026-10-19T10:04:18.311112Z",
  "arret": "contexte_depasse",
  "detail_arret": "contexte du modèle dépassé : tour coupé par le serveur (fin length) après 26500 jetons écrits, sans appel d'outil",
  "controles": [
    {
      "numero": 1,
      "famille": "resultat",
      "poids": 0.3,
      "score": 0.9375,
      "detail": "thomas.girard pris du 2026-11-09T00:00:00+01:00 au 2026-11-21T00:00:00+01:00 : INT-2026-0027, INT-2026-0030, INT-2026-0033, INT-2026-0040, INT-2026-0041, INT-2026-0042, INT-2026-0043, INT-2026-0044, INT-2026-0047, INT-2026-0048, INT-2026-0049, INT-2026-0050, INT-2026-0051, INT-2026-0053"
    },
    {
      "numero": 2,
      "famille": "resultat",
      "poids": 0.1,
      "score": 0.0,
      "detail": "0 intervention(s) ajoutée(s) pour c-0191 (aucune), 1 attendue(s)"
    },
    {
      "numero": 3,
      "famille": "contenu",
      "poids": 0.2,
      "score": 0.0,
      "detail": "aucun courriel vers contact@etablissements-boyer-437.example ne donne le jour et l'heure de INT-2026-0027 (09/11 à 08:00) ; aucun courriel vers contact@etablissements-boyer-437.example ne donne le jour et l'heure de INT-2026-0030 (09/11 à 13:30) ; aucun courriel vers contact@etablissements-boyer-437.example ne donne le jour et l'heure de INT-2026-0033 (12/11 à 08:00) ; aucun courriel vers olivier.martin@courriel.example ne donne le jour et l'heure de INT-2026-0041 (10/11 à 13:30) ; aucun courriel vers contact@etablissements-lambert-60.example ne donne le jour et l'heure de INT-2026-0043 (13/11 à 08:00) ; aucun courriel vers contact@etablissements-lambert-60.example ne donne le jour et l'heure de INT-2026-0044 (13/11 à 13:30) ; 0 intervention(s) ajoutée(s) pour c-0191, une seule à annoncer ; aucun courriel vers christophe.guerin@courriel.example ne donne le jour et l'heure de INT-2026-0048 (16/11 à 13:30) ; aucun courriel vers contact@etablissements-bernard-17.example ne donne le jour et l'heure de INT-2026-0049 (17/11 à 08:00) ; aucun courriel vers contact@etablissements-bernard-17.example ne donne le jour et l'heure de INT-2026-0050 (17/11 à 13:30) ; aucun courriel vers michel.martin@courriel.example ne donne le jour et l'heure de INT-2026-0051 (18/11 à 10:00)"
    },
    {
      "numero": 4,
      "famille": "contenu",
      "poids": 0.15,
      "score": 1.0,
      "detail": null
    },
    {
      "numero": 5,
      "famille": "respect_des_regles",
      "poids": 0.15,
      "score": 1.0,
      "detail": null
    },
    {
      "numero": 6,
      "famille": "absence_effet_de_bord",
      "poids": 0.1,
      "score": 1.0,
      "detail": null
    }
  ],
  "score": 0.68125,
  "reussie": false,
  "etapes": 14,
  "jetons": {
    "entree": 44275,
    "entree_en_cache": "?",
    "sortie": 35055
  },
  "cout_dollars": "?",
  "energie_wh": 64.06232848033818,
  "duree_secondes": 925.1976391799981,
  "duree_chronometree_secondes": null,
  "journal": "journaux/h02_la_semaine_de_thomas_girard_r3.jsonl"
}
