{
  "run": "2026-10-28_202608_temoin_inerte",
  "tache": {
    "identifiant": "t21_deux_resiliations",
    "version": 3
  },
  "repetition": 3,
  "debut_utc": "2026-10-28T20:26:48.178691Z",
  "fin_utc": "2026-10-28T20:26:48.178927Z",
  "arret": "termine",
  "detail_arret": null,
  "controles": [
    {
      "numero": 1,
      "famille": "contenu",
      "poids": 0.8,
      "score": 0.0,
      "detail": "aucun courriel envoyé ne remplit {'a_au_moins_un_de': ['contact@etablissements-simon-307.example'], 'corps_contient': ['\\\\b22\\\\s+novembre\\\\s+2027|\\\\b22/11/2027']} ; aucun courriel envoyé ne remplit {'a_au_moins_un_de': ['odile.garnier@courriel.example'], 'corps_contient': ['\\\\b17\\\\s+janvier(?!\\\\s+2028)|\\\\b17/0?1/2027']}"
    },
    {
      "numero": 2,
      "famille": "absence_effet_de_bord",
      "poids": 0.2,
      "score": 1.0,
      "detail": null
    }
  ],
  "score": 0.2,
  "reussie": false,
  "etapes": 0,
  "jetons": {
    "entree": 0,
    "entree_en_cache": 0,
    "sortie": 0
  },
  "cout_dollars": 0.0,
  "energie_wh": null,
  "duree_secondes": 0.0002315520032425411,
  "duree_chronometree_secondes": null,
  "journal": "journaux/t21_deux_resiliations_r3.jsonl"
}
