{
  "run": "2026-10-13_040310_reproduction_tau2_qwen_local",
  "tache": {
    "identifiant": "airline_7",
    "version": 1
  },
  "repetition": 3,
  "debut_utc": "2026-10-13T05:37:09.564416Z",
  "fin_utc": "2026-10-13T05:43:41.639695Z",
  "arret": "termine",
  "detail_arret": null,
  "controles": [
    {
      "numero": 1,
      "famille": "resultat",
      "poids": 1.0,
      "score": 0.0,
      "detail": "τ²-bench : récompense 0 ; fin user_stop ; base égale à la cible ; phrases dites 0 sur 1"
    }
  ],
  "score": 0.0,
  "reussie": false,
  "etapes": 19,
  "jetons": {
    "entree": 152923,
    "entree_en_cache": "?",
    "sortie": 15929
  },
  "cout_dollars": "?",
  "energie_wh": 27.021491385029925,
  "duree_secondes": 392.0752751909895,
  "journal": "journaux/airline_7_r3.jsonl"
}
