{
  "run": "2026-10-28_203836_temoin_toujours_faux",
  "tache": {
    "identifiant": "dv13_la_date_d_une_assemblee",
    "version": 1
  },
  "repetition": 1,
  "debut_utc": "2026-10-28T20:39:05.628631Z",
  "fin_utc": "2026-10-28T20:39:05.650098Z",
  "arret": "termine",
  "detail_arret": null,
  "controles": [
    {
      "numero": 1,
      "famille": "resultat",
      "poids": 0.35,
      "score": 0.0,
      "detail": "aucun courriel envoyé ne remplit {'a_au_moins_un_de': ['laure.prevost@mel-perso.example'], 'corps_contient': ['9 juillet'], 'texte_de_l_agent': True}"
    },
    {
      "numero": 2,
      "famille": "respect_des_regles",
      "poids": 0.35,
      "score": 0.0,
      "detail": "aucun courriel envoyé ne remplit {'a_au_moins_un_de': ['melanie.sabatier@domivelle.example'], 'corps_contient': ['9 juillet'], 'corps_ne_contient_pas': ['30 juin']}"
    },
    {
      "numero": 3,
      "famille": "respect_des_regles",
      "poids": 0.2,
      "score": 0.0,
      "detail": "aucun courriel envoyé ne remplit {'a_au_moins_un_de': ['laure.prevost@mel-perso.example'], 'corps_contient': ['9 juillet', 'postale|recommandée'], 'texte_de_l_agent': True}"
    },
    {
      "numero": 4,
      "famille": "absence_effet_de_bord",
      "poids": 0.1,
      "score": 1.0,
      "detail": null
    }
  ],
  "score": 0.1,
  "reussie": false,
  "etapes": 2,
  "jetons": {
    "entree": 0,
    "entree_en_cache": 0,
    "sortie": 0
  },
  "cout_dollars": 0.0,
  "energie_wh": null,
  "duree_secondes": 0.02146320899919374,
  "duree_chronometree_secondes": null,
  "journal": "journaux/dv13_la_date_d_une_assemblee_r1.jsonl"
}
