{
  "run": "2026-10-28_202608_temoin_inerte",
  "tache": {
    "identifiant": "t34_acces_nouvel_apprenti",
    "version": 2
  },
  "repetition": 2,
  "debut_utc": "2026-10-28T20:27:16.382501Z",
  "fin_utc": "2026-10-28T20:27:16.382725Z",
  "arret": "termine",
  "detail_arret": null,
  "controles": [
    {
      "numero": 1,
      "famille": "contenu",
      "poids": 0.8,
      "score": 0.0,
      "detail": "aucun courriel envoyé ne remplit {'a_au_moins_un_de': ['helene.marchal@calorelle.example'], 'corps_contient': ['\\\\bcommun/', 'planning'], 'corps_ne_contient_pas': ['\\\\brh/', '\\\\bclients/', '\\\\badministration/', '\\\\bcommercial/', '\\\\bdirection/']}"
    },
    {
      "numero": 2,
      "famille": "absence_effet_de_bord",
      "poids": 0.2,
      "score": 1.0,
      "detail": null
    }
  ],
  "score": 0.2,
  "reussie": false,
  "etapes": 0,
  "jetons": {
    "entree": 0,
    "entree_en_cache": 0,
    "sortie": 0
  },
  "cout_dollars": 0.0,
  "energie_wh": null,
  "duree_secondes": 0.00022076199820730835,
  "duree_chronometree_secondes": null,
  "journal": "journaux/t34_acces_nouvel_apprenti_r2.jsonl"
}
