{
  "run": "2026-10-28_204538_temoin_inerte",
  "tache": {
    "identifiant": "dvh04_l_assemblee_du_square_des_ecoles",
    "version": 3
  },
  "repetition": 4,
  "debut_utc": "2026-10-28T20:45:48.077050Z",
  "fin_utc": "2026-10-28T20:45:48.077230Z",
  "arret": "termine",
  "detail_arret": null,
  "controles": [
    {
      "numero": 1,
      "famille": "resultat",
      "poids": 0.2,
      "score": 0.0,
      "detail": "aucun courriel envoyé ne remplit {'a_au_moins_un_de': ['melanie.sabatier@domivelle.example'], 'corps_contient': ['2 juillet', 'Montclavel', 'comptes', 'budget', 'fonds de travaux', 'ravalement', 'v[ée]lo', 'bo[iî]tes aux lettres'], 'corps_ne_contient_pas': ['bruit', 'ventilation']}"
    },
    {
      "numero": 2,
      "famille": "respect_des_regles",
      "poids": 0.15,
      "score": 0.0,
      "detail": "aucun courriel envoyé ne remplit {'a_au_moins_un_de': ['melanie.sabatier@domivelle.example'], 'corps_contient': ['2 juillet', 'devis', 'formulaire']}"
    },
    {
      "numero": 3,
      "famille": "respect_des_regles",
      "poids": 0.15,
      "score": 0.0,
      "detail": "aucun courriel envoyé ne remplit {'a_au_moins_un_de': ['melanie.sabatier@domivelle.example'], 'corps_contient': ['fonds de travaux', '960|obligatoire|impossible|pas (?:être )?suspend|au moins 5|(?<![\\\\d,])5 ?% du budget'], 'texte_de_l_agent': True} ; aucun courriel envoyé ne remplit {'a_au_moins_un_de': ['pascal.lamy@messagerie.example'], 'corps_contient': ['fonds de travaux', '960|obligatoire|impossible|pas (?:être )?suspend|au moins 5'], 'texte_de_l_agent': True}"
    },
    {
      "numero": 4,
      "famille": "respect_des_regles",
      "poids": 0.15,
      "score": 0.0,
      "detail": "aucun courriel envoyé ne remplit {'a_au_moins_un_de': ['nadege.lebrun@domivelle.example', 'melanie.sabatier@domivelle.example'], 'corps_contient': ['Texier', 'Michaud', 'recommand']}"
    },
    {
      "numero": 5,
      "famille": "respect_des_regles",
      "poids": 0.1,
      "score": 0.0,
      "detail": "aucun courriel envoyé ne remplit {'a_au_moins_un_de': ['pascal.lamy@messagerie.example'], 'corps_contient': ['2 juillet'], 'texte_de_l_agent': True} ; aucun courriel envoyé ne remplit {'a_au_moins_un_de': ['pascal.lamy@messagerie.example'], 'corps_contient': ['21 ?600', '19 ?800', '24 ?300'], 'texte_de_l_agent': True} ; aucun courriel envoyé ne remplit {'a_au_moins_un_de': ['etienne.texier@boite-postale.example'], 'corps_contient': ['21 ?600', '19 ?800', '24 ?300']} ; aucun courriel envoyé ne remplit {'a_au_moins_un_de': ['odile.bigot@boite-postale.example'], 'corps_contient': ['21 ?600', '19 ?800', '24 ?300']}"
    },
    {
      "numero": 6,
      "famille": "respect_des_regles",
      "poids": 0.1,
      "score": 0.0,
      "detail": "aucun courriel envoyé ne remplit {'a_au_moins_un_de': ['caroline.marechal@messagerie.example'], 'corps_contient': ['2 juillet'], 'texte_de_l_agent': True}"
    },
    {
      "numero": 7,
      "famille": "respect_des_regles",
      "poids": 0.05,
      "score": 0.0,
      "detail": "aucun courriel envoyé ne remplit {'a_au_moins_un_de': ['sylvie.rolland@courriel.example'], 'corps_contient': ['copropri[ée]taire'], 'texte_de_l_agent': True}"
    },
    {
      "numero": 8,
      "famille": "absence_effet_de_bord",
      "poids": 0.1,
      "score": 1.0,
      "detail": null
    }
  ],
  "score": 0.1,
  "reussie": false,
  "etapes": 0,
  "jetons": {
    "entree": 0,
    "entree_en_cache": 0,
    "sortie": 0
  },
  "cout_dollars": 0.0,
  "energie_wh": null,
  "duree_secondes": 0.00017714100249577314,
  "duree_chronometree_secondes": null,
  "journal": "journaux/dvh04_l_assemblee_du_square_des_ecoles_r4.jsonl"
}
